{
  "artifact": "Clearstra/exclusive-grant",
  "claims": [
    "source_locked",
    "machine_probe_substantiated",
    "parity_decision:PASS",
    "parity_passed"
  ],
  "pack": "exclusive-grant",
  "parity_receipts": [
    "seed/parity-provenance/expansion/Clearstra/exclusive-grant/parity-receipts/live-probe.json"
  ],
  "schema": "helix-parity-provenance-statement/1.0",
  "source_locks": [
    "seed/parity-provenance/expansion/Clearstra/exclusive-grant/source-locks/local-pack.json"
  ],
  "statement_id": "provenance:Clearstra:exclusive-grant:live-probe",
  "statement_sha256": "980333aa09419556d3c76f871a735e3ea33227425a65fdcd3118b4e559a91606",
  "target_platform": "Clearstra"
}
