{
  "artifact": "Scorestra/detour-posture",
  "claims": [
    "source_locked",
    "machine_probe_substantiated",
    "parity_decision:PASS",
    "parity_passed"
  ],
  "pack": "detour-posture",
  "parity_receipts": [
    "seed/parity-provenance/expansion/Scorestra/detour-posture/parity-receipts/live-probe.json"
  ],
  "schema": "helix-parity-provenance-statement/1.0",
  "source_locks": [
    "seed/parity-provenance/expansion/Scorestra/detour-posture/source-locks/local-pack.json"
  ],
  "statement_id": "provenance:Scorestra:detour-posture:live-probe",
  "statement_sha256": "2310cd8e59c566bd19cd2ce5ed30e0e2f98e51e4c18ac374e2d71502b73224cc",
  "target_platform": "Scorestra"
}
