{
  "artifact": "Attestra/handback",
  "claims": [
    "source_locked",
    "machine_probe_substantiated",
    "parity_decision:PASS",
    "parity_passed"
  ],
  "pack": "handback",
  "parity_receipts": [
    "seed/parity-provenance/expansion/Attestra/handback/parity-receipts/live-probe.json"
  ],
  "schema": "helix-parity-provenance-statement/1.0",
  "source_locks": [
    "seed/parity-provenance/expansion/Attestra/handback/source-locks/local-pack.json"
  ],
  "statement_id": "provenance:Attestra:handback:live-probe",
  "statement_sha256": "60ac03dbfefc848811443033fe98d29abecce74d6f7cc0a376103176649eaff5",
  "target_platform": "Attestra"
}
