{
  "artifact": "Certstra/orbi-roam",
  "claims": [
    "source_locked",
    "machine_probe_substantiated",
    "parity_decision:PASS",
    "parity_passed"
  ],
  "pack": "orbi-roam",
  "parity_receipts": [
    "seed/parity-provenance/expansion/Certstra/orbi-roam/parity-receipts/live-probe.json"
  ],
  "schema": "helix-parity-provenance-statement/1.0",
  "source_locks": [
    "seed/parity-provenance/expansion/Certstra/orbi-roam/source-locks/local-pack.json"
  ],
  "statement_id": "provenance:Certstra:orbi-roam:live-probe",
  "statement_sha256": "e73b3f57b9cfb23d1b61327885dc9377ae65f808dcb0c70760c49db193d16e40",
  "target_platform": "Certstra"
}
